{
  "$schema": "http://json-schema.org/draft-07/schema#",
  "$id": "https://security-toolkit.dev/schemas/project",
  "title": "Project Configuration Schema",
  "description": "Project-level configuration and metadata",
  "type": "object",
  "required": [
    "id",
    "name",
    "created_at",
    "version"
  ],
  "properties": {
    "id": {
      "type": "string",
      "pattern": "^[0-9a-f]{8}-[0-9a-f]{4}-[0-9a-f]{4}-[0-9a-f]{4}-[0-9a-f]{12}$",
      "description": "Unique project identifier"
    },
    "name": {
      "type": "string",
      "minLength": 1,
      "maxLength": 100,
      "description": "Human-readable project name"
    },
    "created_at": {
      "type": "string",
      "format": "date-time",
      "description": "Project creation timestamp"
    },
    "version": {
      "type": "integer",
      "minimum": 1,
      "description": "Schema version for migration compatibility"
    },
    "description": {
      "type": "string",
      "maxLength": 500,
      "description": "Optional project description"
    },
    "settings": {
      "type": "object",
      "properties": {
        "default_severity_filter": {
          "type": "array",
          "items": {
            "type": "string",
            "enum": ["critical", "high", "medium", "low", "info"]
          },
          "default": ["medium", "high", "critical"],
          "description": "Default severity levels for scans"
        },
        "auto_retire_endpoints": {
          "type": "boolean",
          "default": false,
          "description": "Automatically retire endpoints after N days of inactivity"
        },
        "retention_days": {
          "type": "integer",
          "minimum": 1,
          "maximum": 365,
          "default": 90,
          "description": "Days to retain findings and runs"
        },
        "notifications": {
          "type": "object",
          "properties": {
            "email": {
              "type": "string",
              "format": "email"
            },
            "webhook_url": {
              "type": "string",
              "format": "uri"
            },
            "on_critical_findings": {
              "type": "boolean",
              "default": true
            }
          },
          "additionalProperties": false
        }
      },
      "additionalProperties": false
    },
    "metadata": {
      "type": "object",
      "properties": {
        "last_modified": {
          "type": "string",
          "format": "date-time"
        },
        "created_by": {
          "type": "string",
          "pattern": "^[A-Za-z0-9@._-]+$"
        },
        "tags": {
          "type": "array",
          "items": {
            "type": "string",
            "pattern": "^[A-Za-z0-9_-]+$"
          },
          "maxItems": 10
        },
        "environment": {
          "type": "string",
          "enum": ["development", "staging", "production"],
          "default": "development"
        }
      },
      "additionalProperties": false
    }
  },
  "additionalProperties": false,
  "examples": [
    {
      "id": "550e8400-e29b-41d4-a716-446655440000",
      "name": "Pet Store API",
      "created_at": "2024-01-15T10:30:00Z",
      "version": 1,
      "description": "E-commerce pet store API security testing",
      "settings": {
        "default_severity_filter": ["medium", "high", "critical"],
        "auto_retire_endpoints": false,
        "retention_days": 90,
        "notifications": {
          "email": "security@example.com",
          "on_critical_findings": true
        }
      },
      "metadata": {
        "last_modified": "2024-01-15T10:30:00Z",
        "created_by": "admin@example.com",
        "tags": ["api", "ecommerce", "petstore"],
        "environment": "development"
      }
    }
  ]
}
