{
  "id": "550e8400-e29b-41d4-a716-446655440000",
  "name": "Pet Store API",
  "created_at": "2024-01-15T10:30:00Z",
  "version": 1,
  "description": "E-commerce pet store API security testing",
  "settings": {
    "default_severity_filter": ["medium", "high", "critical"],
    "auto_retire_endpoints": false,
    "retention_days": 90,
    "notifications": {
      "email": "security@petstore.com",
      "on_critical_findings": true
    }
  },
  "metadata": {
    "last_modified": "2024-01-15T10:30:00Z",
    "created_by": "admin@petstore.com",
    "tags": ["api", "ecommerce", "petstore"],
    "environment": "development"
  }
}
